{
  "schema_version": 1,
  "artifact_id": "artifact_publish_ref_001",
  "project_id": "project_store_001",
  "artifact_type": "publish_package_ref",
  "current_version_id": "artifact_version_publish_ref_001_r1",
  "versions": [
    {
      "artifact_version_id": "artifact_version_publish_ref_001_r1",
      "revision": 1,
      "schema_version": 1,
      "content": {
        "package_id": "pkg_001",
        "publishing_schema_version": 2,
        "package_fingerprint": "sha256:package-001",
        "source_artifact_version_ids": ["artifact_version_video_001_r1"],
        "created_at": "2026-07-19T00:00:00Z"
      },
      "created_at": "2026-07-19T00:00:00Z"
    }
  ]
}
